{
  "$schema": "../schemas/magic-ui-registry.schema.json",
  "version": "1.1.1",
  "source": "https://magicui.design/docs/components",
  "upstreamRepository": "https://github.com/magicuidesign/magicui",
  "upstreamRef": "refs/heads/main",
  "upstreamCommit": "2d671cc6c0e0f40e28682c9cbddd16694dcfe627",
  "scope": "every component listed on the official public Components page",
  "count": 76,
  "sourceFileCount": 76,
  "registryItemCount": 76,
  "fileCount": 152,
  "categories": [
    {
      "identifier": "components",
      "title": "Components",
      "count": 16
    },
    {
      "identifier": "special-effects",
      "title": "Special Effects",
      "count": 9
    },
    {
      "identifier": "animations",
      "title": "Animations",
      "count": 1
    },
    {
      "identifier": "text-animations",
      "title": "Text Animations",
      "count": 18
    },
    {
      "identifier": "device-mocks",
      "title": "Device Mocks",
      "count": 3
    },
    {
      "identifier": "buttons",
      "title": "Buttons",
      "count": 3
    },
    {
      "identifier": "backgrounds",
      "title": "Backgrounds",
      "count": 11
    },
    {
      "identifier": "community",
      "title": "Community",
      "count": 15
    }
  ],
  "license": {
    "spdx": "MIT",
    "copyright": "Copyright (c) Magic UI",
    "upstreamPath": "LICENSE.md",
    "sourceURL": "https://github.com/magicuidesign/magicui/blob/2d671cc6c0e0f40e28682c9cbddd16694dcfe627/LICENSE.md",
    "sourcePath": "Sources/MagicUI/LICENSE.md",
    "sha256": "0147b84235ed916b8b4e89c1f80655351c5afe7d211b629be61f553a227b34ba",
    "bytes": 1060
  },
  "components": [
    {
      "id": "android",
      "name": "android",
      "title": "Android",
      "category": "device-mocks",
      "categoryTitle": "Device Mocks",
      "language": "TypeScript TSX",
      "documentationURL": "https://magicui.design/docs/components/android",
      "upstreamPath": "apps/www/registry/magicui/android.tsx",
      "sourceURL": "https://raw.githubusercontent.com/magicuidesign/magicui/2d671cc6c0e0f40e28682c9cbddd16694dcfe627/apps/www/registry/magicui/android.tsx",
      "sourcePath": "Sources/MagicUI/Components/android.tsx",
      "sha256": "9235d2e9204078c65ff8077bf8adc6b3ed4b12c55a8354345faa8f8abbddb5cf",
      "bytes": 2860,
      "dependencies": [],
      "registryDependencies": [],
      "registryItem": {
        "upstreamPath": "apps/www/public/r/android.json",
        "sourceURL": "https://raw.githubusercontent.com/magicuidesign/magicui/2d671cc6c0e0f40e28682c9cbddd16694dcfe627/apps/www/public/r/android.json",
        "sourcePath": "Sources/MagicUI/Registry/android.json",
        "sha256": "8740bfc1757a42d7ed9fa89e9ae1b85faeb9bf95081dd45ebd63a7f8eb441b7f",
        "bytes": 3350
      }
    },
    {
      "id": "animated-beam",
      "name": "animated-beam",
      "title": "Animated Beam",
      "category": "special-effects",
      "categoryTitle": "Special Effects",
      "language": "TypeScript TSX",
      "documentationURL": "https://magicui.design/docs/components/animated-beam",
      "upstreamPath": "apps/www/registry/magicui/animated-beam.tsx",
      "sourceURL": "https://raw.githubusercontent.com/magicuidesign/magicui/2d671cc6c0e0f40e28682c9cbddd16694dcfe627/apps/www/registry/magicui/animated-beam.tsx",
      "sourcePath": "Sources/MagicUI/Components/animated-beam.tsx",
      "sha256": "6afa2ee1d01694a428eb8517d48deebe5c6b532dc0ee871800bb9d92aae43e79",
      "bytes": 4986,
      "dependencies": [
        "motion"
      ],
      "registryDependencies": [],
      "registryItem": {
        "upstreamPath": "apps/www/public/r/animated-beam.json",
        "sourceURL": "https://raw.githubusercontent.com/magicuidesign/magicui/2d671cc6c0e0f40e28682c9cbddd16694dcfe627/apps/www/public/r/animated-beam.json",
        "sourcePath": "Sources/MagicUI/Registry/animated-beam.json",
        "sha256": "4b68e61eb2cfa71bbf4bff6ea50665be6e04dd9168f40b86de13a406eb49fcef",
        "bytes": 5705
      }
    },
    {
      "id": "animated-circular-progress-bar",
      "name": "animated-circular-progress-bar",
      "title": "Animated Circular Progress Bar",
      "category": "community",
      "categoryTitle": "Community",
      "language": "TypeScript TSX",
      "documentationURL": "https://magicui.design/docs/components/animated-circular-progress-bar",
      "upstreamPath": "apps/www/registry/magicui/animated-circular-progress-bar.tsx",
      "sourceURL": "https://raw.githubusercontent.com/magicuidesign/magicui/2d671cc6c0e0f40e28682c9cbddd16694dcfe627/apps/www/registry/magicui/animated-circular-progress-bar.tsx",
      "sourcePath": "Sources/MagicUI/Components/animated-circular-progress-bar.tsx",
      "sha256": "c7f974283804607484afba34a5886af027cb58528a1987f392c35a577a77a782",
      "bytes": 3524,
      "dependencies": [],
      "registryDependencies": [],
      "registryItem": {
        "upstreamPath": "apps/www/public/r/animated-circular-progress-bar.json",
        "sourceURL": "https://raw.githubusercontent.com/magicuidesign/magicui/2d671cc6c0e0f40e28682c9cbddd16694dcfe627/apps/www/public/r/animated-circular-progress-bar.json",
        "sourcePath": "Sources/MagicUI/Registry/animated-circular-progress-bar.json",
        "sha256": "604443ef02973dfc2ab2838a065ffa532e5b26b9827a816b1370bdfe2203c33d",
        "bytes": 4188
      }
    },
    {
      "id": "animated-gradient-text",
      "name": "animated-gradient-text",
      "title": "Animated Gradient Text",
      "category": "text-animations",
      "categoryTitle": "Text Animations",
      "language": "TypeScript TSX",
      "documentationURL": "https://magicui.design/docs/components/animated-gradient-text",
      "upstreamPath": "apps/www/registry/magicui/animated-gradient-text.tsx",
      "sourceURL": "https://raw.githubusercontent.com/magicuidesign/magicui/2d671cc6c0e0f40e28682c9cbddd16694dcfe627/apps/www/registry/magicui/animated-gradient-text.tsx",
      "sourcePath": "Sources/MagicUI/Components/animated-gradient-text.tsx",
      "sha256": "e5f0b81be1a9dc707199c2fd10c588bde872c72a02e2eb6d195d080112a34692",
      "bytes": 871,
      "dependencies": [],
      "registryDependencies": [],
      "registryItem": {
        "upstreamPath": "apps/www/public/r/animated-gradient-text.json",
        "sourceURL": "https://raw.githubusercontent.com/magicuidesign/magicui/2d671cc6c0e0f40e28682c9cbddd16694dcfe627/apps/www/public/r/animated-gradient-text.json",
        "sourcePath": "Sources/MagicUI/Registry/animated-gradient-text.json",
        "sha256": "7ad5ffebc064485fdfec12b2fc365cfc30fce09518e52301090475c899c4b0e1",
        "bytes": 1549
      }
    },
    {
      "id": "animated-grid-pattern",
      "name": "animated-grid-pattern",
      "title": "Animated Grid Pattern",
      "category": "backgrounds",
      "categoryTitle": "Backgrounds",
      "language": "TypeScript TSX",
      "documentationURL": "https://magicui.design/docs/components/animated-grid-pattern",
      "upstreamPath": "apps/www/registry/magicui/animated-grid-pattern.tsx",
      "sourceURL": "https://raw.githubusercontent.com/magicuidesign/magicui/2d671cc6c0e0f40e28682c9cbddd16694dcfe627/apps/www/registry/magicui/animated-grid-pattern.tsx",
      "sourcePath": "Sources/MagicUI/Components/animated-grid-pattern.tsx",
      "sha256": "fda051f51f5b805983beb855633e05bfcbf17a4b94a2459e5352d8bd624f618a",
      "bytes": 4410,
      "dependencies": [
        "motion"
      ],
      "registryDependencies": [],
      "registryItem": {
        "upstreamPath": "apps/www/public/r/animated-grid-pattern.json",
        "sourceURL": "https://raw.githubusercontent.com/magicuidesign/magicui/2d671cc6c0e0f40e28682c9cbddd16694dcfe627/apps/www/public/r/animated-grid-pattern.json",
        "sourcePath": "Sources/MagicUI/Registry/animated-grid-pattern.json",
        "sha256": "c5d5798b1fee16a64ceb3c9756a47bb5ddb9948e3d89fd4868b11b02d1fea410",
        "bytes": 5066
      }
    },
    {
      "id": "animated-list",
      "name": "animated-list",
      "title": "Animated List",
      "category": "components",
      "categoryTitle": "Components",
      "language": "TypeScript TSX",
      "documentationURL": "https://magicui.design/docs/components/animated-list",
      "upstreamPath": "apps/www/registry/magicui/animated-list.tsx",
      "sourceURL": "https://raw.githubusercontent.com/magicuidesign/magicui/2d671cc6c0e0f40e28682c9cbddd16694dcfe627/apps/www/registry/magicui/animated-list.tsx",
      "sourcePath": "Sources/MagicUI/Components/animated-list.tsx",
      "sha256": "9363c5afa61d7aab1919b4500f7325cc8871b35103d5dd60a2a1625fe5e7dc58",
      "bytes": 2036,
      "dependencies": [
        "motion"
      ],
      "registryDependencies": [],
      "registryItem": {
        "upstreamPath": "apps/www/public/r/animated-list.json",
        "sourceURL": "https://raw.githubusercontent.com/magicuidesign/magicui/2d671cc6c0e0f40e28682c9cbddd16694dcfe627/apps/www/public/r/animated-list.json",
        "sourcePath": "Sources/MagicUI/Registry/animated-list.json",
        "sha256": "a95ae266e0eda12b8230724c690818a434d22bad0a2093a8197417cc997d298b",
        "bytes": 2586
      }
    },
    {
      "id": "animated-shiny-text",
      "name": "animated-shiny-text",
      "title": "Animated Shiny Text",
      "category": "text-animations",
      "categoryTitle": "Text Animations",
      "language": "TypeScript TSX",
      "documentationURL": "https://magicui.design/docs/components/animated-shiny-text",
      "upstreamPath": "apps/www/registry/magicui/animated-shiny-text.tsx",
      "sourceURL": "https://raw.githubusercontent.com/magicuidesign/magicui/2d671cc6c0e0f40e28682c9cbddd16694dcfe627/apps/www/registry/magicui/animated-shiny-text.tsx",
      "sourcePath": "Sources/MagicUI/Components/animated-shiny-text.tsx",
      "sha256": "3743a0a0b4894840a96bacd839e493872bac484a940684f91fd23a1784c00fbb",
      "bytes": 999,
      "dependencies": [],
      "registryDependencies": [],
      "registryItem": {